domanda,opzioneA,opzioneB,opzioneC,opzioneD,soluzione,motivazione
"A consequence of the deployment of VLANs in a local area network is:","The network security increases as frames are encrypted","The creation on virtual interfaces on switches","Users must be authenticated","The broadcast traffic is bounded to the VLAN where it has been generated",D,"Le VLAN segmentano il dominio di broadcast: un pacchetto broadcast inviato in una VLAN non raggiunge le altre."
"Qual è l'uso dei meccanismi di policing?","Servono all'utente per concordare con il fornitore il livello di QoS.","Servono al fornitore di servizi per verificare che il traffico immesso dal cliente sia conforme agli accordi presi.","Servono all'utente per verificare che il traffico in arrivo dal fornitore sia conforme agli accordi presi.","Sono usati nei vari router per garantire un tempo massimo di attraversamento per ciascuno di essi.",B,"Il policing controlla che il traffico in ingresso rispetti i parametri (es. banda massima) del contratto (SLA) e scarta/marca l'eccedenza."

"La metrica (costo) in un algoritmo di instradamento esprime","Il peso da assegnare ad un collegamento e usato nella selezione del cammino","La probabilità che venga utilizzato il cammino più breve","La complessità di calcolo dell'algoritmo",N/A,A,"La metrica è il valore numerico che l'algoritmo minimizza per trovare il percorso 'migliore' (shortest path)."

Domanda,OpzioneA,OpzioneB,OpzioneC,OpzioneD,Soluzione,Motivazione
"La combinazione di meccanismi di secchiello dei token (o secchio bucato) e Weighted Fair Queueing (WFQ) serve a garantire:","Un tempo di attraversamento massimo di un router.","Un tempo di attraversamento massimo di un NAT.","Una banda massima per ogni flusso di pacchetti.","Un burst massimo di pacchetti consecutivi, per ciascun flusso.",A,"Il Token Bucket controlla il burst e la velocità media, mentre il WFQ garantisce una gestione equa delle code, permettendo di determinare limiti deterministici sul ritardo di accodamento."
"Le soluzioni di VPN (virtual private network) basate su SSL (secure socket layer) consentono:","Di distribuire in modo sicuro su diversi server applicazioni basate sul web","Di creare cluster di server privati","Ad un'azienda di rendere disponibili in modo sicuro ai propri dipendenti fuori sede specifiche applicazioni aziendali.","La realizzazione di un backbone sul quale un fornitore di servizi (service provider) può facilmente ed efficientemente fornire servizi di connettività ai suoi clienti",C,"Le SSL VPN (spesso clientless o via browser) sono ideali per dare accesso granulare a specifiche applicazioni interne (web, mail) a utenti remoti senza estendere l'intera rete."
"Un host appartenente ad una certa VLAN","Può contattare solo host nella stessa VLAN","Può contattare host nelle altre VLAN tramite un router","N/A","N/A",B,"Le VLAN isolano i domini di broadcast. Per comunicare tra VLAN diverse è necessario un dispositivo di livello 3 (router o switch L3) che faccia routing."
"Gli algoritmi di scheduling vengono utilizzati:","Nei router di accesso, per assicurarsi che il traffico generato da un utente sia conforme al profilo...","Nei firewall, per ritardare i pacchetti...","Nei router, per decidere quale sia l'ordine con cui debbano essere trasmessi i pacchetti in attesa ad una interfaccia.","Nei router, per schedulare opportunamente l'elenco dei comandi...",C,"Lo scheduling (es. FIFO, WFQ, Priority Queuing) determina l'ordine di servizio dei pacchetti nelle code di uscita delle interfacce, influenzando QoS e ritardi."
"The Frequency Reuse in a cellular network refers to","The reuse of frequencies usually adopted for other services","The reuse of the same frequency to send consecutive text messages","The reuse of the same frequency for all the phone calls made by a terminal","The reuse of the same frequency in different cells that are sufficiently distant",D,"Il riuso delle frequenze è il concetto base delle reti cellulari: la stessa frequenza può essere usata in celle diverse purché l'interferenza co-canale sia accettabile (distanza sufficiente)."
"Nel protocollo di routing BGP:","Le informazioni di topologia hanno sempre la precedenza sull'applicazione delle politiche...","L'applicazione delle politiche di instradamento (""policy"") ha sempre la precedenza rispetto alle informazioni di topologia","Viene scelto sempre il percorso a costo inferiore verso ogni destinazione","Viene scelto sempre il percorso a costo inferiore... a meno di limitazioni...",B,"BGP è un protocollo basato su policy (Policy-Based Routing); le decisioni amministrative dell'AS prevalgono sui semplici percorsi più brevi."
"What is the typical role of IPSec in VPNS?","To distribute in a secure way the key required by other protocols","To allow the transmission of authentication information...","To open a managed secure tunnel across the public internet","To verify the user identity to allow other protocols...",C,"IPsec fornisce l'infrastruttura di sicurezza (cifratura e incapsulamento) per creare tunnel sicuri su reti pubbliche IP."
"Virtual LANS (VLANs) are","Networks that are able to emulate on a given LAN the presence of a remote device...","Networks created only among Virtual Machines (VMs)","Virtually distinct local area networks but created over a single physical infrastructure","Very high performance wireless networks",C,"Le VLAN permettono di segmentare logicamente una singola infrastruttura fisica (switch e cavi) in più reti locali distinte."
"Il meccanismo dello ""Split Horizon"" permette di:","Eliminare la possibilità che si verifichino loop in seguito a cambiamenti della topologia","Ridurre la probabilità che si verifichino loop in seguito a cambiamenti della topologia","Disabilitare, durante la fase di convergenza, l'invio di pacchetti...","Diminuire il traffico di routing...",B,"Lo Split Horizon evita di annunciare una rotta all'interfaccia da cui è stata appresa, riducendo i loop semplici, ma non elimina tutti i loop complessi (serve il Poison Reverse o Hold Down)."
"nella soluzione di livello 3 di vpn basate su MPLS e BGP i pachetti che transitano sulla dorsale MPLS hanno due etichette","i router interni (p) non modificano(swap) mai l'etichetta più esterna","l'etichetta più esterna è usata dai router interni(p) per inoltrare verso un router PE","l'etichetta più interna è usata dai router interni(p) per inoltrare verso un router PE","entrambe le etichette sono usate dai router interni (P)...",B,"L'etichetta esterna serve al trasporto nel backbone (verso il PE di uscita); quella interna identifica la VPN del cliente ed è letta solo dal PE finale."
"The configuration of a switch port in access mode is used for","Allowing the access to the switch only to specific flows...","Enabling the access to the network","Assigning a packet received on that port to a specific VLAN","Assigning a packet sent through that port to a specific VLAN",C,"Una porta in modalità Access appartiene a una sola VLAN; il traffico entrante non taggato viene associato a quella specifica VLAN."
"Nel protocollo OSPF, gli LSA di tipo Network Link presenti nel Link State Database...","Le adiacenze di ogni router con le reti IP configurate sulle proprie interfacce","Le reti IP presenti nel dominio OSPF ma in aree differenti...","Le adiacenze con le reti di transito presenti nel dominio OSPF","Le adiacenze con le reti di transito presenti nell'area in esame",D,"Gli LSA Type 2 (Network Link) sono generati dal Designated Router (DR) e descrivono i router connessi al segmento di rete multi-access (transito) all'interno dell'area."
"The Mapping Address and Port (MAP) technique for the IPv4-IPv6 transition is based on","The utilization, on the CPE, of an IPv6 address derived from the IPv4 address and the Port Set ID...","The utilization, on the Border Relay, of an IPv6 address...","The utilization, on the CPE, of an IPv6 address selected among a fixed set...","The utilization, on the CPE, of an IPv6 address which varies on the basis of the IPv4 destination...",A,"MAP (Mapping of Address and Port) è una tecnica stateless che codifica l'indirizzo IPv4 e un range di porte (Port Set ID) all'interno dell'indirizzo IPv6 della CPE."
"RIP, caratteristica:","Necessità della configurazione da parte dell'amministratore per funzionare","Comunica informazioni con i router vicini","E' in grado di rilevare gli indirizzi IP degli host collegati...",N/A,B,"RIP è un protocollo Distance Vector che annuncia periodicamente la propria tabella di routing solo ai router direttamente connessi (vicini)."
"In MPLS (unlike in IP) support for scalable traffic engineering is specifically enabled by","The availability of efficient label distribution protocols","The deployment of a unified control plane","The deployment of dynamic and distributed routing protocols","The forwarding information in the data plane not being automatically updated when the routing information changes",D,"Il Traffic Engineering in MPLS è possibile perché il percorso (LSP) può essere fissato (explicit routing) e non segue automaticamente il percorso IGP più breve, disaccoppiando routing e forwarding."
"Una BSC (Base Station Controller)","è il punto di accesso per il MT","Contiene i dati statici dell'utente","è in grado di controllare una singola BTS","è in grado di controllare un grande numero di BTS",D,"Nel GSM, la BSC controlla decine o centinaia di BTS, gestendo le risorse radio e gli handover tra di esse."
"le comunicazioni multicast in una rete ipv4","sono possibili solo all'interno di una singola rete lan...","sono sempre possibili, IGMP le rende solo più efficienti","non sono possibili senza l'utilizzo di protocolli aggiuntivi nella rete","sono possibili su scala geografica grazie all'utilizzo del solo protocollo IGMP",C,"Il routing multicast (PIM, DVMRP) è necessario per trasportare il traffico multicast attraverso i router; senza di esso, il multicast non passa le sottoreti."
"The ICMPv6 Router Advertisement packet","Enables device autoconfiguration without a DHCP protocol intervention","Is sent as a reply to an ICMPv6 Neighbor Solicitation packet","Is a broadcast packet","Is sent periodically by a router to all the other routers...",A,"Il messaggio RA fornisce il prefisso di rete agli host, permettendo loro di generare il proprio indirizzo IPv6 (SLAAC) senza bisogno di un server DHCP."
"Le soluzioni di VPN (virtual private network) di livello 3 basate su MPLS sono caratterizzate da","Livelli particolarmente alti di sicurezza...","Buon livello di automatizzazione e integrazione tra la dorsale pubblica e le reti private","Meccanismi di tunneling di livello 3, ovvero all'interno di pacchetti IP",N/A,C,"Le VPN MPLS L3 usano etichette MPLS (Layer 2.5) per creare tunnel, non necessariamente tunnel IP-in-IP (come GRE o IPsec), ma funzionalmente separano routing L3."
"L'indirizzo IPv6 2001:4600::0201:06FF:FEA5:3A4C è:","Un indirizzo di tipo privato","Un indirizzo utilizzabile da un server per offrire un servizio sulla Internet pubblica IPv6","Un indirizzo utilizzabile da un host unicamente per effettuare delle comunicazioni con un altro host sullo stesso link","Un indirizzo al momento non valido in IPv6",B,"Inizia con 2001::/16, che è il prefisso per gli indirizzi Global Unicast (pubblici) assegnati."
"In un pacchetto che viaggia su una rete MPLS, è possibile avere più label contemporaneamente?","No, non è previsto.","Sì, ma non più di 2.","Sì, ma non più di 20.","Si, ma solo nei tunnel MPLS usati per le VPN.",C,"MPLS supporta lo stacking delle etichette (Label Stack) teoricamente indefinito (limitato solo dall'MTU), usato per VPN, Traffic Engineering (Fast Reroute), ecc."
"The main contribution to the latency experienced in the nodes of a heavily loaded packet network is given by","The time needed to process the packet.","The time taken to transmit the packet on an output link","The time taken to locate... the information need to forward","The time spent in buffers while waiting for resources occupied by other packets",D,"In condizioni di carico elevato (congestione), il tempo di accodamento (queueing delay) è la componente dominante della latenza."
"Il protocollo IGMP","Permette ad un router IPv4 di scoprire quali gruppi multicast sono presenti in una rete ad esso direttamente connessa","Permette ad un host IPv4 di creare un nuovo gruppo multicast","Permette ad un router IPv4 di scoprire quali gruppi multicast sono attivi... nella rete Internet","E' una nuova versione del protocollo ICMP",A,"IGMP serve ai router per sapere se ci sono membri di un gruppo multicast nella LAN locale per decidere se inoltrare o meno il traffico."
"The term handover in cellular networks refers to","The movement... even if in that moment there are no active communications","The movement of a mobile terminal from a cell to another without the interruption of an active communication","The use of a mobile terminal in the network of a different operator","The turn-on of the mobile terminal...",B,"L'handover è specifico per il mantenimento della connessione attiva durante lo spostamento tra celle."
"La tecnica di forwarding ""Source Routing"":","Prevede l'utilizzo di client molto semplici...","è adatta quando si vuole minimizzare il numero di bytes...","Il nodo mittente deve avere una conoscenza (almeno parziale) della topologia di rete","è la tecnica comunemente utilizzata dal protocollo IP...",C,"Nel Source Routing, il mittente decide il percorso. Per farlo, deve conoscere la topologia della rete."
"The Random Access CHannel (RACH) in a GSM network is used","By mobile terminals for sending voice samples...","By the network, for offering dedicated communication channels","By mobile terminals, for requesting dedicated communication channels to the network","By mobile terminals for sending voice samples...",C,"Il RACH è il canale di uplink usato dai terminali per chiedere l'assegnazione di un canale dedicato (SDCCH/TCH) per iniziare una chiamata o inviare dati."
"Which type of cloud Delivery Model has major control and responsibility over its configuration and utilization?","Security-as-a-Service","Infrastructure-as-a-Service (IaaS)","Software-as-a-Service (SaaS)","Platform-as-a-Service (PaaS)",B,"In IaaS, l'utente gestisce il sistema operativo, il middleware e le applicazioni, avendo il controllo maggiore rispetto a PaaS e SaaS."
"Data una rete... è possibile realizzare un piano di indirizzamento in grado di ottimizzare il routing su un certo router di quella rete:","Assegnando... indirizzi scelti randomicamente...","Assegnando... in ordine decrescente di dimensione della rete","Dividendo la rete in aree e definendo... range di indirizzi distinti da utilizzare in ciascuna di quelle aree",N/A,C,"L'assegnazione gerarchica (per aree) permette l'aggregazione delle rotte (route summarization), riducendo la dimensione delle tabelle di routing."
"When an MPLS frame has multiple labels. routers","Only process the most external label to decide how to forward the frame","Only process the most Internal label...","Only can swap the most external and the next label...","Can swap any of the labels",A,"I router MPLS (LSR) prendono decisioni di inoltro basandosi esclusivamente sull'etichetta in cima allo stack (most external)."
"La caratteristica di una VPN di accesso centralizzata è che","Il traffico non diretto alla VPN viene fatto passare comunque attraverso il VPN gateway.","L'autenticazione... viene delegato all'ISP.","Il traffico non diretto alla VPN non è costretto a passare...","L'autenticazione... non viene fatta dal VPN gateway.",A,"Nelle VPN ad accesso centralizzato (full-tunnel), tutto il traffico del client, incluso quello per Internet, passa per il tunnel aziendale per sicurezza e filtraggio."
"Cosa sono i bursts?","Sono dei pacchetti che viaggiano sulla rete IP","Sono trame che viaggiano attraverso onde radio","Sono blocchi dati che viaggiano su circuit switched networks","Sono i raggruppamenti di celle di dimensione G",C,"(In contesto GSM/TDMA) I burst sono le unità fisiche di trasmissione contenenti i dati (voce/segnalazione) inserite negli slot temporali."
"aumentando il numero di VLAN","Aumentano i domini di collisione","Diminuiscono i domini di collisione","Aumentano i domini di broadcast","Diminuiscono i domini di broadcast",C,"Ogni VLAN è un dominio di broadcast separato. Più VLAN = Più domini di broadcast (più piccoli)."
"Per il supporto dei prefissi di rete a lunghezza variabile in una zona della rete in cui sia utilizzato routing dinamico:","La netmask associata al prefisso deve essere fornita ai router in fase di configurazione","La netmask viene dedotta automaticamente","Le informazioni di routing... devono includere la subnet mask associata ad ogni prefisso annunciato","E obbligatorio l'utilizzo dei protocolli OSPF o BGP",C,"I protocolli classless (RIPv2, OSPF, EIGRP, BGP) devono trasportare la subnet mask insieme all'indirizzo IP per supportare VLSM."
"An ARP Request that a host with IP address 130.192.10.1/24 sends to learn the MAC address of a host with IP address 130.192.10.200","Arrives at the destination if the two hosts are connected by means of an Ethernet switch...","Never arrives at the destination","Actually, the ARP Request is not sent because the destination host is outside the IP network of the source","Always arrives at the destination...",A,"Entrambi gli IP sono nella stessa sottorete (/24). L'ARP Request è broadcast e attraversa lo switch arrivando a destinazione."
"Data una certa LAN su cui sono state definite delle VLAN, una frame broadcast:","Raggiunge possibilmente solo una porzione della LAN","Raggiunge tutti gli host della LAN",N/A,N/A,A,"Il broadcast raggiunge solo le porte appartenenti alla stessa VLAN del mittente, che è solo una porzione della LAN fisica totale."
"The Frequency Reuse in a cellular network refers to","The reuse of frequencies usually adopted for other services","The reuse of the same frequency to send consecutive text messages","The reuse of the same frequency for all the phone calls made by a terminal","The reuse of the same frequency in different cells that are sufficiently distant",D,"(Duplicata della 55)."
"Il protocollo IS-IS","E' un protocollo di routing obsoleto...","E' un protocollo di routing basatao sull'algoritmo link state molto utilizzato nelle reti di grosse dimensioni","E' un protocollo usato dagli switch Ethernet...","E' un protocollo evoluzione del BGP...",B,"IS-IS è un protocollo Link State (come OSPF) scalabile e agnostico rispetto al protocollo di rete (usato per IP e CLNP), molto usato nei backbone ISP."
"Il protocollo di routing BGP:","Utilizza regole (policy) su informazioni aggiuntive a metriche di costo per identificare il ""migliore""...","è utilizzato esclusivamente per scambi di informazioni tra router di autonomous system differenti","è utilizzato esclusivamente per scambi di informazioni tra router dello stesso autonomous system","è il protocollo che andrà a sostituire OSPF",A,"BGP seleziona i percorsi migliori basandosi su attributi (AS-Path, Local Pref, ecc.) manipolati da policy amministrative, non solo su metriche tecniche."
"Le operazioni che un router MPLS può effettuare sui label sono le seguenti:","Aggiungere un label in posizione qualsiasi...","Aggiungere un label in posizione più esterna... (PUSH), eliminare il label nella posizione più esterna... (POP), cambiare il contenuto del label esterno (SWAP).","Aggiungere un label solo se non ce ne sono altri...","I label non possono essere manipolati...",B,"Le operazioni MPLS standard (Push, Pop, Swap) avvengono solo in cima allo stack (Top of Stack)."
"Quanti tipi di bursts esistono?","3: Regular, Access and Synchronization","2: Regular and Access","5: Regular, Access, Synchronization, Frequency Correction and Dummy","1: Regular",C,"Nel GSM esistono 5 tipi di burst fisici con funzioni diverse (dati, accesso, sincronizzazione, correzione frequenza, riempimento)."
"The Duplicate Address Detection (DAD) procedure","Is used in IPv6 In order to check that a host could also acquire an IPv4 address","Is used in IPv6 in order to check that the MAC address selected for a host is not already in use","Is used in IPv4...","Is used in IPv6 in order to check that the IPv6 address selected for a host is not already in use",D,"DAD è parte di NDP in IPv6 e serve a garantire che un indirizzo (anche autoconfigurato) sia unico sul link prima di usarlo."
"L'autoconfigurazione stateless di IPv6 presenta problemi di riservatezza?","Non vi sono particolari problemi.","Non permette la cifratura del carico.","E' possibile individuare la stessa interfaccia, se si collega a internet da vari provider.","Non permette l'uso delle intestazioni di sicurezza (tipo IPsec).",C,"Poiché l'Interface ID è derivato dal MAC address (hardware fisso), l'host è tracciabile attraverso reti diverse. Le Privacy Extensions risolvono questo problema."
"ssaflma;lf ;jfpjpoe wf egwg","ss","wegw g",N/A,N/A,B,"[Domanda spazzatura/test nel file originale. La soluzione indicata è B]."
"Le reti 192.168.1.0/24 e 192.168.2.0/24 sono aggregabili in:","192.168.0.0/23","0.0.0.0/0","192.168.1.0/23","Non sono aggregabili.",B,"(Duplicata della 5). Non sono contigue per formare una /23. La risposta 'catch-all' è 0.0.0.0/0 o nessuna."
"OSPF-TE and ISIS-TE include enhancements... to","Include adequate fields in routing messages to support explicit routing","Allow the independence of control plane and data plane...","Enable the distribution of additional information (named constrained data) in support of constraint based routing","Ensure faster convergence...",C,"Le estensioni TE trasportano informazioni sulle risorse (banda, attributi link) per permettere il calcolo di percorsi vincolati (CSPF)."
"Le così dette soluzioni VPN (virtual private network) di accesso o virtual dial-up VPN attualmente più diffuse sono basate su:","Connessioni dial-up.","Tunnelling attraverso una rete IP.","Utilizzo di un'infrastruttura di cablaggio esistente...","Nuovi protocolli di linea...",B,"Le moderne VPN di accesso remoto usano tunnel IP (IPsec, SSL/TLS) su Internet, sostituendo le vecchie connessioni dial-up dirette (RAS)."
"Handover è il meccanismo che permette di:","criptare un canale di comunicazione","gestire lo sgancio da una cella e il riaggancio ad una nuova","notificare ad un utente una chiamata in arrivo","richiedere accesso alla rete da parte di un utente",B,"(Duplicata della 19 e 75)."
"il fatto che una VPN offra accesso ad internet centralizzato implica che","la rete aziendale utilizzi un singolo internet service provider","non è necessario utilizzare dispositivi per la protezione...","i pacchetti inviati verso stazioni non appartenenti alla rete privata... potrebbero seguire un percorso non ottimale","l'impatto del traffico pubblico... viene ridotto",C,"Il 'tromboning' del traffico verso il gateway centrale allunga il percorso rispetto all'uscita diretta locale su Internet."
"L'architettura MPLS (multi-protocol label switching) è caratterizzato da:","Un diverso meccanismo (rispetto all'IP puro) per decidere l'interfaccia di uscita...","Protocolli di routing particolarmente veloci...","Terminali di rete intelligenti...","Un supporto particolarmente evoluto per fornire servizi a qualità garantita.",A,"MPLS usa il Label Swapping (Exact Match su label) invece del Longest Prefix Match su indirizzo IP."
"La procedura di Neighbor Discovery in IPv6","E' basata su un pacchetto ICMPv6 inviato in multicast","E' basata su un pacchetto ICMPv6 inviato in broadcast","E' basata su ARPv6","Richiede che la rete supporti anche IPv4",A,"NDP usa messaggi ICMPv6 su multicast (Solicited-Node) per risolvere indirizzi L2 (sostituendo ARP)."
"indirizzi global unicast aggregatable","Possono essere usati solo dai router","Possono essere usati solo dagli host","Sono distribuiti geograficamente in modo gerarchico",N/A,C,"Sono strutturati per essere aggregati nelle tabelle di routing globali, seguendo gerarchie di provider (LIR, ISP, ecc.)."
"Lo stack protocollare dell'interfaccia radio si articola nei seguenti livelli","MAC layer, IP layer, TCP/UDP layer","MAC layer, Manage protocol layer","MAC layer, RLC layer, RRC layer","Esiste un singolo livello",C,"(Duplicata della 53 nel set precedente) Stack radio LTE/UMTS: PHY, MAC, RLC, PDCP, RRC."
"L'importanza di MPLS... deriva dalla possibilità di","Realizzare commutatori con supporto specifico per garantire qualità del servizio","Avere un unico piano di controllo per diverse tencologie di commutazione","Realizzare apparati in grado di operare senza bisogno di configurazione","Distribuire il traffico su batterie di server",B,"MPLS offre un Control Plane IP unificato per gestire diverse tecnologie di trasporto sottostanti (ATM, FR, Ethernet)."
"li indirizzi in IPv6 di tipo Site Local","Vengono assegnati da un'autorità centrale...","Sono deprecati ma possono essere comunque usati","Non esistono","Sono impostati automaticamente...",B,"Gli indirizzi Site-Local (FEC0::/10) sono stati ufficialmente deprecati (RFC 3879) e sostituiti dagli ULA, ma possono esistere in reti legacy."
"Nella connessione UMTS","Esiste ancora il riuso delle frequenze, con possibili interferenze","Non esiste più il riuso delle frequenze e non si hanno interferenze grazie all'utilizzo di codici diversi","Esiste ancora il riuso delle frequenze, ma ottimizzato...","Non esiste più il riuso delle frequenze...",B,"UMTS usa W-CDMA: tutte le celle usano la stessa frequenza (riuso 1). L'interferenza è gestita tramite codici ortogonali/pseudo-casuali."
