domanda,opzioneA,opzioneB,opzioneC,opzioneD,soluzione,motivazione
"Split Horizon technique","Route received not advertised back to source","Prefix not advertised to next hop","Destination unreachable","None",B,"Previene i loop evitando di annunciare una rotta all'interfaccia da cui quella rotta è stata appresa."
"LSA Router Link describes","Link to adjacent router","Summary","List of routers","Link parameters",A,"Un LSA di tipo 1 (Router Link) elenca i link del router e i vicini connessi ad essi all'interno dell'area."
"LTE channel access","FDMA","CDMA","OFDMA","TDMA",C,"LTE utilizza OFDMA (Orthogonal Frequency Division Multiple Access) per il downlink e SC-FDMA per l'uplink."
"QoS guaranteed when","ATM used","Nodes use scheduling/shaping","Apps code info","None",B,"La QoS richiede meccanismi attivi nei nodi di rete (code, scheduler, policer) per trattare diversamente i flussi."
"Ethernet collision reason","Full duplex","Switched half duplex","Queue","Contention",B,"Le collisioni avvengono negli switch solo se le porte sono configurate in Half Duplex (CSMA/CD attivo); in Full Duplex non ci sono collisioni."
"Source Routing forwarding","Simple host","Minimize bytes","Sender knows topology","Standard IP",C,"Nel Source Routing, il mittente specifica la sequenza di router che il pacchetto deve attraversare, richiedendo conoscenza della topologia."
"IPv6 Reboot address","Random","FE80::/32","Link-local same (MAC based)","Router config",C,"L'indirizzo Link-Local è solitamente derivato staticamente dal MAC address (EUI-64), quindi rimane lo stesso tra i riavvii (a meno di Privacy Extensions)."
"Multipath routing","Supported RIP","Faster transient","Can cause loops if costs differ","TCP only",C,"Se i percorsi hanno costi diversi e i router non sono sincronizzati perfettamente o usano regole diverse, il pacchetto può rimbalzare (loop)."
"Isolated Routing","Exchange neighbors","Exchange all","Based only on local traffic","Partition",C,"Il routing isolato (es. Hot Potato, Flooding puro) non usa scambi di protocollo complessi ma decisioni basate su info locali o traffico passante."
"MPLS Label Swapping","Not suitable QoS","Keep same label","Same table","Requires Path Setup",D,"Il Label Swapping richiede che le tabelle di forwarding (LFIB) siano popolate in anticipo (Path Setup) tramite protocolli di segnalazione (LDP/RSVP)."
"Neutral Access Point (NAP/IXP)","Router central","Peering (L2 connection)","L2 connection","L3 visibility",B,"Un NAP o IXP è un'infrastruttura fisica (solitamente uno switch L2) dove diversi AS si collegano per fare peering."
"OSPF metric","Length","Bandwidth/Delay","Configurable metric (cost)","Hop Count",C,"OSPF usa un 'costo' arbitrario per link, che di default è inversamente proporzionale alla banda (Reference Bandwidth / Link Bandwidth)."
"802.11 Collision result","No ACK","RTS","NACK","RTS sender",A,"Nel Wi-Fi non c'è rilevamento collisioni (CD); una collisione si deduce dalla mancata ricezione dell'ACK."
"Trunk port Ethernet switch","Send traffic without VLAN","Send traffic with VLAN tag","Receive single VLAN","Send single VLAN",B,"Una porta Trunk (802.1Q) aggiunge un tag al frame Ethernet per indicare a quale VLAN appartiene, trasportando più VLAN."
"6PE solution labels","Inner->IPv6, Outer->IPv6","Internal->PE","External->PE","Outer->PE",D,"In 6PE, l'etichetta esterna serve per attraversare il core MPLS IPv4 fino al PE di uscita; l'etichetta interna indica che il payload è IPv6."
"FDMA Network","One frequency","No voice","Random freq","Frequencies divided and reused",D,"Le frequenze sono risorse scarse, quindi vengono riutilizzate in celle non adiacenti (cluster) per minimizzare l'interferenza co-canale."
"IPv6 strength","Encryption","Address space","10Gb/s","Names",B,"Il vantaggio principale e trainante di IPv6 è l'enorme spazio di indirizzamento (128 bit) rispetto a IPv4."
"One reason enabling IPv6 spread","Scarce MAC","Inefficiency of private IPv4 (NAT complexity)","Multicast","Operators lazy",B,"La complessità e i limiti del NAT su larga scala (Carrier Grade NAT) spingono verso l'adozione di indirizzi globali IPv6."
"ARP Request across subnet (A to B via switch)","Arrives","Never arrives","Not sent (outside network)","Always",C,"Se A e B sono su sottoreti logiche diverse (mask diverse) ma stesso switch L2, A non manda ARP per B perché lo ritiene 'remoto'. Manda ARP per il Gateway."
"Stateless Autoconfig Privacy issue","No problem","No encryption","Trackable interface (same ID)","No IPsec",C,"L'uso del MAC address per generare l'Interface ID rende il dispositivo tracciabile ovunque si colleghi. Le Privacy Extensions risolvono questo problema."
"Optical networks characterized by","Fiber links","Switching optical channel (wavelength)","Routing IP","Transport data labels",B,"La caratteristica distintiva è la capacità di commutare interi canali ottici (lambda) senza conversione ottico-elettrico-ottico (OEO)."
"Variable Length Prefixes support","Netmask config","Automatic class","Routing info includes subnet mask","OSPF mandatory",C,"Per supportare VLSM (Variable Length Subnet Masking) il protocollo di routing deve trasportare la maschera di sottorete insieme al prefisso (protocolli Classless)."0...0...0
"Quale è la funzione dello ""scope"" associato agli indirizzi IPv6?","Serve a risolvere, in casi particolari, l'ambiguità riguardo il mittente.","Non esiste uno scope associato agli indirizzi IPv6.","Serve per poter utilizzare gli indirizzi globali.","Serve per poter utilizzare gli indirizzi anycast.",A,"Lo scope (es. link-local, site-local, global) definisce l'ambito di validità e unicità dell'indirizzo, risolvendo ambiguità su dove un pacchetto può essere instradato."
"In the 6PE solution packets traveling through the MPLS backbone have two labels;","The internal label is used by internal (P) routers to forward packets towards an IPv6 destination.","The external label is used by internal (P) routers to forward packets towards an IPv6 destination.","The internal label is used by internal (P) routers to forward packets towards a PE router.","The external label is used by internal (P) routers to forward packets towards a PE router.",D,"In 6PE, l'etichetta esterna (transport label) serve ai router P per commutare il pacchetto verso l'egress PE, mentre quella interna identifica la destinazione IPv6 finale."
"In IEEE 802.11 networks, the hidden terminal problem refers to","The possibility that two or more wireless nodes can interfere with each other without knowing it","A security threat caused by an Intruder in the BSS","A failure in the association to an Access Pont during the passive scanning procedure","The use of the same MAC address by more than one node to the same BSS",A,"Il problema del terminale nascosto si verifica quando due nodi non si sentono a vicenda ma sono entrambi connessi allo stesso AP, causando collisioni al ricevitore."
"Due host collegati ad uno switch Ethernet","Possono comunicare solo se appartenenti alla stessa VLAN, qualsiasi sia la configurazione della rete","Possono comunicare anche se appartenenti a VLAN diverse, dipende dalla configurazione della rete","Devono poter comunicare sempre senza utilizzare un router intermedio","Non possono comunicare utilizzando un router in quanto connessi allo stesso switch.",B,"Se le porte sono configurate su VLAN diverse, gli host possono comunicare solo se c'è un router (o switch L3) che instrada il traffico tra le VLAN (Inter-VLAN routing)."
"Le reti 192.168.1.0/24 e 192.168.2.0/24 sono aggregabili in:","192.168.0.0/23","192.168.1.0/23","0.0.0.0/0","Non sono aggregabili.",C,"Le reti non sono contigue nel blocco binario per formare una /23 (la 1.0 e la 2.0 sono separate; servirebbero 0.0 e 1.0, oppure 2.0 e 3.0). L'aggregazione minima comune valida è molto più ampia (es. /22 o 0.0.0.0/0 come 'catch-all'). [Nota: la soluzione nel testo indica 0.0.0.0/0 probabilmente come unica opzione valida tra quelle date]."
"La tecnica ""Path Vector"" impiegata dal BGP:","Memorizza nei Path Vectors l'elenco degli Autonomous Systems da attraversare per raggiungere una data rete di destinazione","Memorizza nei Path Vectors l'elenco di routers da attraversare per raggiungere una data rete di destinazione","Memorizza nei Path Vectors il prossimo Autonomous System da attraversare per raggiungere una data rete di destinazione","Memorizza nei Path Vectors il prossimo router da attraversare per raggiungere una data rete di destinazione",A,"L'attributo AS_PATH del BGP contiene la sequenza degli AS attraversati, fondamentale per evitare loop di routing inter-dominio."
"The Interface ID of an ipv6 address","Is assigned by the network administstrator according to a hierarchical schema","Can be arbttranty selected. sometimes It ts denved from the MAC address of the Interface","Is asstqned by the ISP according to a hierarchical scherna","Is the same for all devices with the same link",B,"L'Interface ID (gli ultimi 64 bit) può essere generato tramite EUI-64 (basato sul MAC), casualmente (Privacy Extensions) o assegnato manualmente."
"Un algoritmo di routing di tipo selective flooding:","E' sostanzialmente simile all'algoritmo di flooding classico, con la differenza che ciascun pacchetto in arrivo viene ritrasmesso su tutte le linee eccetto quella su cui è stato ricevuto","E' sicuramente più robusto di un classico algoritmo di flooding","Consente di ridurre il numero di volte in cui un pacchetto viene inviato sulla stessa porzione di rete","Richiede che i pacchetti inviati contengano un numero di sequenza",C,"Il selective flooding invia i pacchetti solo verso i router che si trovano nella direzione della destinazione, riducendo il traffico rispetto al flooding puro."
"Secondo 6PE","I router Provider Edge (PE) sono dual stack","i router Provider P sono sono IPv4, i router Provider Edge PE sono solo Ipv6","tutti i router MPLS sono IPv4","tutti i router MPLS sono dual stack",A,"In 6PE, i router PE devono supportare sia IPv4 che IPv6 (Dual Stack) per incapsulare il traffico IPv6 in MPLS e trasportarlo sul core IPv4."
"A differenza della versione 4 dell'IP, la versione 6:","Non ha una versione dell'ICMP associata.","Non permette di scoprire l'indirizzo MAC di un'altra stazione, conoscendone l'indirizzo IP.","Non ha indirizzi broadcast.","Non ha un equivalente del campo TTL (time-to-live).",C,"IPv6 elimina il broadcast e utilizza indirizzi multicast (es. all-nodes multicast) per le funzioni equivalenti."
"il count to infinity","permette di capire se un nodo non è più raggiungibile","è una variante dell'algoritmo link state ch evita la creazione di loop","è uno stato transitorio dell'algoritmo distance vector","nessuna delle precedenti",D,"[Nota: La soluzione indicata è D. Tecnicamente il count-to-infinity è un problema dei protocolli Distance Vector (opzione C imprecisa?) che causa loop temporanei]."
"Nel IPv6 cosa sparisce dalle intestazioni, rispetto a IPv4?","Il tempo di vita del pacchetto.","Gli indirizzi mittente e destinatario.","L'indicazione su quale sia l'intestazione successiva.","Il checksum dell'intestazione.",D,"IPv6 rimuove il campo checksum dall'header per ridurre il carico di elaborazione sui router, affidandosi ai controlli di errore dei livelli inferiori e superiori."
"La tecnica ""Path Vector"" permette di:","Risolvere il problema del count to infinity","Risolvere il problema delle route sovrapposte","Rendere il protocollo ""trasparente"" rispetto all'informazione trasportata","Nessuna delle precedenti",A,"Conoscendo l'intera sequenza degli AS attraversati, un router può scartare percorsi che contengono il proprio AS, prevenendo i loop infiniti tipici del Distance Vector."
"L'architettura MPLS (multi-protocol label switching) è caratterizzato da","Un diverso meccanismo (rispetto all'IP puro) per decidere l'interfaccia di uscita verso cui un pacchetto debba essere inoltrato.","Un supporto particolarmente evoluto per fornire servizi a qualità garantita.","Protocolli di routing particolarmente veloci ad aggiornare le tabelle di routing in seguito a cambiamenti topologici in modo da recuperare velocemente i guasti.","Terminali di rete intelligenti in grado di personalizzare i servizi ricevuti dalla rete.",A,"MPLS usa il Label Swapping (scambio di etichette) invece del Longest Prefix Match sugli indirizzi IP per prendere decisioni di inoltro."
"In the fully operational OSPF protocol, all routers have in memory:","The same tree of optimal routes","The database describing the area to which they belong","The same database describing the entire AS","A Distance Vector set of all neighboring routers",B,"I router OSPF mantengono un Link State Database (LSDB) identico per tutti i router appartenenti alla stessa area."
"Il frequency hopping (FH) permette","di trasmettere bursts consecutivi su frequenze diverse a discapito di una riduzione della capacità","di trasmettere slot consecutivi sulla stessa frequenza con una riduzione della capacità","di trasmettere bursts consecutivi su frequenze diverse con un aumento della capacità","di trasmettere bursts consecutivi sulla stessa frequenza",A,"Il salto di frequenza migliora la qualità del segnale riducendo le interferenze e il fading, ma non aumenta la capacità del canale."
"L'autoconfigurazione stateless in IPv6 richiede:","Un server DHCPv6.","Un server presente sulla rete locale.","Un server presente sulla rete aziendale (intranet).","È possibile anche se non si è in presenza di server o router.",D,"SLAAC permette a un host di configurarsi ascoltando i Router Advertisement (RA) dai router locali, senza bisogno di server DHCP centrali."
"i gruppi multicast in ipv4","vengono identificati da particolari indirizzi IP che non possono essere assegnati alle singole stazioni","vengono identificati dalla lista degli indirizzi MAC delle stazioni appartenenti ad un dato gruppo.","non esistono","vengono identificati dalla lista degli indirizzi IP delle stazioni appartenenti ad un dato gruppo.",A,"Gli indirizzi di Classe D (224.0.0.0/4) identificano gruppi logici di host e non interfacce singole (unicast)."
"Un LSA Router Link del protocollo OSPF descrive:","Un link che connette l'advertising router con uno dei router ad esso adiacenti","Un riassunto delle reti raggiungibili","La lista dei router connessi in una LAN","Il valore corrente dei parametri relativi ad un link tra due router",A,"LSA Type 1 (Router Link) elenca tutti i link del router e i vicini ad essi connessi."
"when a MPLS frame has multiple labels, routers:","only can swap the next external and the next label to each other","only process the next internal label to decide how to forward the frame","can swap any of the labels","only process the next eternal label to decide how to forward the frame",D,"[Soluzione D intesa come 'external']. I router commutano basandosi solo sull'etichetta più esterna (top of stack)."
"An IPSec-based VPN (Virtual Private Network)","Requires that the end points support the IPSec protocol","Requires that the involved Gateway supports the IPsec protocol","Deploys tunneling to allow encryption and/or authentication of IP packets exchanged by corporate hosts","The encryption is mandatory, while the authentication is optional",C,"IPsec usa protocolli come ESP e AH in modalità tunnel per cifrare e autenticare i pacchetti IP che viaggiano su reti pubbliche."
"Il protocollo GRE ha lo scopo di:","Proteggere i pacchetti contro le intercettazioni.","Gestire l'incapsulamento di pacchetti da trasportare attraverso un tunnel.","Autenticare il mittente dei pacchetti.","Verificare l'integrità dei pacchetti in arrivo.",B,"GRE è un protocollo di incapsulamento generico che permette di trasportare qualsiasi protocollo di livello 3 sopra una rete IP."
"Nell'algoritmo di routing di tipo Path Vector:","Ogni record contenuto nel Path Vector contiene la destinazione, la distanza dal router in esame, e il next hop router","Ogni record contiene la destinazione, la distanza, e il prossimo Autonomous System","Ogni record contiene la destinazione, la distanza, e l'elenco dei router da attaversare","Ogni record contiene la destinazione, la distanza, e l'elenco degli Autonomous System da attraversare",C,"[Nota: la soluzione indicata è C 'elenco dei router', ma BGP Path Vector memorizza elenco degli AS. Nel testo la risposta corretta è la C, forse intesa come 'Path Vector generico']. Errata corrige: Nel BGP è la lista degli AS."
"Il protocollo RIP prevede meccanismi per ridurre la possibilità di verificarsi di loop:","Attraverso l'analisi dei pacchetti in transito","Per mezzo di processi di traceroute","Attraverso meccanismi di Split-Horizon e di Hold-Down","Nessuna delle risposte precedenti",C,"Split Horizon (non annunciare route da dove le hai imparate) e Hold-Down Timer sono tecniche standard per mitigare i loop nei protocolli Distance Vector."
"Le reti private virtuali (virtual private network, VPN) vengono utilizzate per","Trasportare traffico privato su una infrastruttura condivisa ricreando le stesse condizioni che si avrebbero tramite l'utilizzo di una infrastruttura privata","Suddividere una rete locale aziendale in sottoreti","Partizionare una rete privata in varie reti virtualmente separate",N/A,A,"Definizione classica di VPN: estensione sicura della rete privata su infrastruttura pubblica."
"In una interfaccia radio, tra le tante funzioni il MAC layer","Permette il controllo del flusso","Permette l'accesso al canale","Esegue la negoziazione e il controllo del QoS","Nessuna delle precedenti",B,"Il livello MAC (Medium Access Control) gestisce l'arbitraggio per l'accesso al mezzo condiviso (radio)."
"Filtering table of a VLAN:","It can only be updated manually","It can be updated manually or automatically with appropriate protocols","Contains only local network Ips",N/A,B,"Le tabelle di filtering (FDB) sugli switch si aggiornano automaticamente apprendendo i MAC address sorgente (learning) o tramite protocolli di gestione (es. GMRP/GVRP)."
"Select the correct response","End to end VPN is always better than site to site VPN","Firewall and IDS cannot be placed inside a network protected by a VPN gateway","Skewed channel is a type of IPsec tunnel","None of the options",D,"Le affermazioni A, B, C sono false o inesatte. Quindi D."
"One of the protocols used in MPLS for label distribution is:","L2TP","OSPF","IS-IS","BGP",D,"Oltre a LDP, il protocollo BGP (MP-BGP) è usato per distribuire etichette, specialmente per le VPN MPLS."
"Il fattore che ha contribuito al rallentamento della diffusioner di Ipv6 é:","La possibilità di utilizzare indirizzi ipv4 privati per connettersi a internet","Una diminuzione del numero di dispositivi","Un ritiro e redistribuzione piú accorta degli indirizzi IPv4 già usati","Un miglior utilizzo della rete internet da parte degli utenti finali",A,"L'uso massiccio del NAT (con indirizzi privati RFC1918) ha prolungato la vita di IPv4 mitigando l'esaurimento degli indirizzi, rallentando la spinta verso IPv6."
"The Timing Advance in the GSM is","The capability of a mobile terminal to operate in different time zones","The beginning of the transmission at a mobile terminal after the beginning of its assigned time-slot","The beginning of the transmission at a mobile terminal before the beginning of its assigned time-slot","The beginning of the transmission before SDCCH creation",C,"Timing Advance compensa il ritardo di propagazione dicendo al cellulare di trasmettere un po' in anticipo affinché il segnale arrivi alla base station nello slot temporale corretto."
"La differenza tra gli algoritmi di instradamento di tipo link state e distance vector si può riassumere come segue","LS inviano info interezza a tutti; DV info locali solo ai vicini","LS inviano info locali solo ai vicini; DV interezza a tutti","LS inviano info locali a tutti; DV interezza solo ai vicini",N/A,C,"Link State: inonda lo stato dei propri link a tutti (LSA flooding). Distance Vector: manda il proprio vettore delle distanze (tutto ciò che sa) solo ai vicini."
"Gli indirizzi Ipv6","Permettono la comunicazione di stazioni IPv6 con stazioni IPv4 senza nessun particolare meccanismo aggiuntivo.","Mantengono la stessa suddivisione flessibile tra una parte network e una parte host già presente in IPv4.","Sono rigidamente partizionati in una parte network, subnetwork e host.","Sono rigidamente partizionati in una parte network e una parte host.",B,"IPv6 mantiene la struttura prefisso di rete + identificativo host (Interface ID), simile alla logica netmask di IPv4 (CIDR)."
"Nei protocolli di routing, il periodo di transitorio:","è presente solo quando vengono adottati gli algoritmi più semplici (es. Distance Vector)","Non è mai presente","Si verifica sempre nel periodo immediatamente successivo al rilevamento di un guasto","Si verifica sempre nel momento in cui una parte della rete cambia di stato",D,"Il transitorio è il tempo necessario affinché la rete converga a un nuovo stato stabile dopo un cambiamento topologico (guasto o aggiunta)."
"Le entry del filtering database di uno switch Ethernet","Hanno tutte validità temporale infinita","Hanno una validità temporale generalmente impostabile dall'amministratore dello switch","Hanno tutte validità temporale inferiore al secondo","Hanno una validità temporale che varia nel tempo",B,"Le voci apprese dinamicamente hanno un Aging Time (solitamente 300s), configurabile dall'amministratore."
"When an IPv6 host needs to learn the MAC address associated to a given IPv6 address","It can send a specific ICMPv6 message in multicast over the network","It can send a specific ICMPv6 message in unicast over the network","It can send an ARP Request in broadcast over the network","It can send a specific ICMPv6 message in broadcast over the network",A,"Usa il messaggio Neighbor Solicitation (ICMPv6 tipo 135) inviato all'indirizzo multicast Solicited-Node."
"Which of these techniques is not a solution for the IPv4-IPv6 transition?","6mix4","Teredo","6to4","6over4",A,"6mix4 non esiste. Le altre sono tecniche di tunneling o traduzione valide."
"One of the reasons that are favoring the spread of the IPv6 protocol is","The more and more widespread need to use multicast applications","The low inclination of network operators to modify the configuration of their own networks","The possible inefficiency of the private IPv4 addressing","The lack of MAC addresses",C,"Le limitazioni e le complessità introdotte dal NAT su larga scala (Carrier Grade NAT) rendono l'indirizzamento privato IPv4 inefficiente per certe applicazioni."
"Il Multipath routing:","è supportato dalle maggiori implementazioni di RIP","Permette ai router di utilizzare percorsi multipli durante i transitori","Può essere causa di loop se si ammette che i percorsi utilizzati possano avere costi differenti","E consigliato solamente se il traffico dati è composto prevalentemente da pacchetti TCP",C,"Se i router usano percorsi multipli con costi diversi senza un coordinamento rigoroso (es. ECMP con costi uguali), si possono creare cicli di instradamento."
"Due trame ethernet possono collidere per quale motivo?","Switched full duplex","Switched half duplex","Per colpa della coda nei buffer dello switch","Capita spesso a causa della contesa del canale",B,"In una rete switched moderna, le collisioni avvengono solo se la porta è configurata in Half Duplex, dove si applica il CSMA/CD."
"Quale di queste tecniche non è una soluzione per la transizione IPV4-IPV6?","6to4","Teredo","6over4","6mix4",D,"(Domanda duplicata della 37 - conferma 6mix4 come risposta errata)."
"What did it contribute to slow down the spread of IPv6","The recall and a more careful reallocation of all the IPv4 addresses already in use","A more careful utilization of the Internet network by final users","The possibility to use private IPv4 addresses for the Internet access","The decrease of the number of connected devices",C,"(Simile alla 30) L'uso di NAT e indirizzi privati ha ritardato l'esaurimento percepito degli indirizzi IPv4."
"Router A-B-C-D ad anello. Se A invia a D con flooding, quante copie riceve D?","1","2","4","Proporzionale al TTL",B,"In un anello semplice, il flooding invia il pacchetto in entrambe le direzioni (orario e antiorario), quindi D lo riceverà da due lati (da C e da A/B)."
"Given a network... optimize routing on a given router by","Assigning distinct network IDs randomly","Splitting network in areas and defining smaller distinct address ranges","Assigning distinct network IDs selected within the address range in decreasing order of network size",N/A,B,"L'assegnazione gerarchica degli indirizzi (aggregazione) permette di riassumere molte route in poche entry nella tabella di routing."
"Which of the following choices is not an Adaptive Routing algorithm?","Selective Flooding","Isolated Routing","Link State","Centralized Routing",A,"Il Flooding (anche selettivo) è una tecnica di inoltro non adattiva in senso stretto (non cambia tabella in base al carico/costo dinamico), anche se 'Isolated' è spesso citato come statico/semplice. [Nota: Soluzione file è A]."
"La differenza tra gli algoritmi di instradamento di tipo link state e distance vector si può riassumere come segue","LS info interezza a tutti; DV info locali solo ai vicini","LS info locali solo ai vicini; DV interezza a tutti","LS info locali a tutti; DV interezza solo ai vicini",N/A,C,"(Duplicato della 32)."
"Il protocollo di routing OSPF sceglie il percorso verso una destinazione tenendo conto di:","Lunghezza di ciascun link lungo il percorso","Banda e ritardo per ogni link","Può essere configurato ad utilizzare svariate metriche","Hop Count",C,"OSPF usa un 'costo' per link. Sebbene di default Cisco usi la banda (10^8/BW), la metrica è un valore adimensionale configurabile dall'amministratore."
